{
  "$id": "https://example.org/hpo-translations/ontology-network/crosswalk_edge.schema.json",
  "$schema": "https://json-schema.org/draft/2020-12/schema",
  "additionalProperties": false,
  "properties": {
    "agent_panel_assessment_required": {
      "type": "boolean"
    },
    "candidate_only": {
      "type": "boolean"
    },
    "confidence": {
      "type": "number"
    },
    "edge_id": {
      "type": "string"
    },
    "external_id": {
      "type": "string"
    },
    "external_source_id": {
      "type": "string"
    },
    "hpo_id": {
      "type": "string"
    },
    "maintainer_promotion_decision_required": {
      "type": "boolean"
    },
    "mapping_basis": {
      "type": "string"
    },
    "mapping_predicate": {
      "type": "string"
    },
    "mapping_source": {
      "type": "string"
    },
    "provenance_id": {
      "type": "string"
    },
    "review_status": {
      "type": "string"
    }
  },
  "required": [
    "agent_panel_assessment_required",
    "candidate_only",
    "confidence",
    "edge_id",
    "external_id",
    "external_source_id",
    "hpo_id",
    "maintainer_promotion_decision_required",
    "mapping_basis",
    "mapping_predicate",
    "mapping_source",
    "provenance_id",
    "review_status"
  ],
  "title": "crosswalk_edge",
  "type": "object",
  "x-schema-version": "2.0.0"
}
